{
  "version": "1.0.0-draft.6",
  "tokens": [
    {
      "path": "seed.background",
      "type": "color",
      "description": "Scheme background seed.",
      "example": {
        "colorSpace": "srgb",
        "components": [
          0.98,
          0.97,
          0.95
        ]
      },
      "default": null,
      "range": null,
      "deprecated": null,
      "reserved": true,
      "highContrastDefault": null,
      "forcedColor": "canvas"
    },
    {
      "path": "seed.foreground",
      "type": "color",
      "description": "Scheme foreground seed.",
      "example": {
        "colorSpace": "srgb",
        "components": [
          0.12,
          0.12,
          0.14
        ]
      },
      "default": null,
      "range": null,
      "deprecated": null,
      "reserved": true,
      "highContrastDefault": null,
      "forcedColor": "canvas-text"
    },
    {
      "path": "seed.accent",
      "type": "color",
      "description": "Scheme accent seed.",
      "example": {
        "colorSpace": "oklch",
        "components": [
          0.55,
          0.15,
          250
        ]
      },
      "default": null,
      "range": null,
      "deprecated": null,
      "reserved": true,
      "highContrastDefault": null,
      "forcedColor": "link-text"
    },
    {
      "path": "seed.font-family",
      "type": "fontFamily",
      "description": "Font family seed.",
      "example": [
        "system-ui",
        "sans-serif"
      ],
      "default": null,
      "range": null,
      "deprecated": null,
      "reserved": true
    },
    {
      "path": "color.surface.base",
      "type": "color",
      "description": "Primary application surface.",
      "example": {
        "colorSpace": "srgb",
        "components": [
          0.98,
          0.97,
          0.95
        ]
      },
      "default": "{seed.background}",
      "range": null,
      "deprecated": null,
      "highContrastDefault": "{seed.background}",
      "forcedColor": "canvas"
    },
    {
      "path": "color.surface.raised",
      "type": "color",
      "description": "Raised surface above the base.",
      "example": {
        "colorSpace": "srgb",
        "components": [
          1,
          1,
          1
        ]
      },
      "default": {
        "$derive": {
          "op": "color.mix-bounded",
          "args": {
            "color": "{seed.background}",
            "toward": "{seed.foreground}",
            "ratio": 0.04,
            "reference": "{seed.foreground}",
            "minimum": 4.5
          }
        }
      },
      "range": null,
      "deprecated": null,
      "highContrastDefault": {
        "$derive": {
          "op": "color.contrast-adjust",
          "args": {
            "color": "{seed.background}",
            "backgrounds": [
              "{seed.foreground}"
            ],
            "target": 7
          }
        }
      },
      "forcedColor": "canvas"
    },
    {
      "path": "color.surface.sunken",
      "type": "color",
      "description": "Recessed surface below the base.",
      "example": {
        "colorSpace": "srgb",
        "components": [
          0.94,
          0.93,
          0.91
        ]
      },
      "default": {
        "$derive": {
          "op": "color.mix",
          "args": {
            "color": "{seed.background}",
            "toward": "{seed.foreground}",
            "ratio": 0.06
          }
        }
      },
      "range": null,
      "deprecated": null,
      "highContrastDefault": {
        "$derive": {
          "op": "color.contrast-adjust",
          "args": {
            "color": "{seed.background}",
            "backgrounds": [
              "{seed.foreground}"
            ],
            "target": 7
          }
        }
      },
      "forcedColor": "canvas"
    },
    {
      "path": "color.surface.overlay",
      "type": "color",
      "description": "Modal or popover surface.",
      "example": {
        "colorSpace": "srgb",
        "components": [
          1,
          1,
          1
        ]
      },
      "default": "{color.surface.raised}",
      "range": null,
      "deprecated": null,
      "highContrastDefault": "{color.surface.raised}",
      "forcedColor": "canvas"
    },
    {
      "path": "color.text.primary",
      "type": "color",
      "description": "Primary body text.",
      "example": {
        "colorSpace": "srgb",
        "components": [
          0.12,
          0.12,
          0.14
        ]
      },
      "default": "{seed.foreground}",
      "range": null,
      "deprecated": null,
      "highContrastDefault": {
        "$derive": {
          "op": "color.contrast-adjust",
          "args": {
            "color": "{seed.foreground}",
            "backgrounds": [
              "{color.surface.base}"
            ],
            "target": 7
          }
        }
      },
      "forcedColor": "canvas-text"
    },
    {
      "path": "color.text.secondary",
      "type": "color",
      "description": "Supporting text such as captions and metadata.",
      "example": {
        "colorSpace": "srgb",
        "components": [
          0.36,
          0.37,
          0.4
        ]
      },
      "default": {
        "$derive": {
          "op": "color.contrast-adjust",
          "args": {
            "color": {
              "$derive": {
                "op": "color.mix",
                "args": {
                  "color": "{seed.foreground}",
                  "toward": "{seed.background}",
                  "ratio": 0.35
                }
              }
            },
            "backgrounds": [
              "{color.surface.base}",
              "{color.surface.raised}",
              "{color.surface.sunken}"
            ],
            "target": 4.5
          }
        }
      },
      "range": null,
      "deprecated": null,
      "highContrastDefault": "{color.text.primary}",
      "forcedColor": "gray-text"
    },
    {
      "path": "color.text.disabled",
      "type": "color",
      "description": "Disabled text.",
      "example": {
        "colorSpace": "srgb",
        "components": [
          0.55,
          0.55,
          0.58
        ]
      },
      "default": {
        "$derive": {
          "op": "color.mix",
          "args": {
            "color": "{seed.foreground}",
            "toward": "{seed.background}",
            "ratio": 0.55
          }
        }
      },
      "range": null,
      "deprecated": null,
      "highContrastDefault": {
        "$derive": {
          "op": "color.mix",
          "args": {
            "color": "{seed.foreground}",
            "toward": "{seed.background}",
            "ratio": 0.4
          }
        }
      },
      "forcedColor": "gray-text"
    },
    {
      "path": "color.text.on-action",
      "type": "color",
      "description": "Text on primary action backgrounds.",
      "example": {
        "colorSpace": "srgb",
        "components": [
          1,
          1,
          1
        ]
      },
      "default": {
        "$derive": {
          "op": "color.contrast-select",
          "args": {
            "backgrounds": [
              "{color.action.primary.background}"
            ],
            "candidates": [
              "{seed.background}",
              "{seed.foreground}"
            ],
            "target": 4.5
          }
        }
      },
      "range": null,
      "deprecated": null,
      "highContrastDefault": {
        "$derive": {
          "op": "color.contrast-adjust",
          "args": {
            "color": "{seed.foreground}",
            "backgrounds": [
              "{color.action.primary.background}"
            ],
            "target": 7
          }
        }
      },
      "forcedColor": "button-text"
    },
    {
      "path": "color.text.on-status",
      "type": "color",
      "description": "Text on status backgrounds.",
      "example": {
        "colorSpace": "srgb",
        "components": [
          1,
          1,
          1
        ]
      },
      "default": {
        "$derive": {
          "op": "color.contrast-select",
          "args": {
            "backgrounds": [
              "{color.status.danger.background}"
            ],
            "candidates": [
              "{seed.background}",
              "{seed.foreground}"
            ],
            "target": 4.5
          }
        }
      },
      "range": null,
      "deprecated": null,
      "highContrastDefault": {
        "$derive": {
          "op": "color.contrast-select",
          "args": {
            "backgrounds": [
              "{color.status.danger.background}"
            ],
            "candidates": [
              "{seed.background}",
              "{seed.foreground}"
            ],
            "target": 7
          }
        }
      },
      "forcedColor": "button-text"
    },
    {
      "path": "color.border.subtle",
      "type": "color",
      "description": "Subtle borders and dividers.",
      "example": {
        "colorSpace": "srgb",
        "components": [
          0.82,
          0.82,
          0.84
        ]
      },
      "default": {
        "$derive": {
          "op": "color.mix",
          "args": {
            "color": "{seed.background}",
            "toward": "{seed.foreground}",
            "ratio": 0.18
          }
        }
      },
      "range": null,
      "deprecated": null,
      "highContrastDefault": {
        "$derive": {
          "op": "color.contrast-adjust",
          "args": {
            "color": "{seed.foreground}",
            "backgrounds": [
              "{color.surface.base}"
            ],
            "target": 3
          }
        }
      },
      "forcedColor": "button-border"
    },
    {
      "path": "color.border.strong",
      "type": "color",
      "description": "Strong borders for controls.",
      "example": {
        "colorSpace": "srgb",
        "components": [
          0.55,
          0.55,
          0.58
        ]
      },
      "default": {
        "$derive": {